{
  "$schema": "https://json-schema.org/draft/2020-12/schema",
  "$id": "https://syncfit.edge/schemas/user-profile.schema.json",
  "title": "UserProfile",
  "description": "Athlete profile with anthropometrics, objective and baseline loads per exercise. Guests use ephemeral profiles; registered users keep history.",
  "type": "object",
  "additionalProperties": false,
  "required": ["schema_version", "profile_id", "display_name", "language"],
  "properties": {
    "schema_version": { "$ref": "common.schema.json#/$defs/SchemaVersion" },
    "profile_id": { "$ref": "common.schema.json#/$defs/Uuid" },
    "display_name": { "type": "string", "minLength": 1 },
    "language": { "$ref": "common.schema.json#/$defs/Language" },
    "is_guest": { "type": "boolean" },
    "height_cm": { "type": "number", "minimum": 80, "maximum": 250 },
    "weight_kg": { "type": "number", "minimum": 20, "maximum": 300 },
    "body_fat_pct": { "type": "number", "minimum": 3, "maximum": 60 },
    "daily_calories": { "type": "integer", "minimum": 800, "maximum": 6000 },
    "age": { "type": "integer", "minimum": 10, "maximum": 100 },
    "objective": { "$ref": "common.schema.json#/$defs/UserObjective" },
    "goal_phase": { "$ref": "common.schema.json#/$defs/GoalPhase" },
    "modality": { "$ref": "common.schema.json#/$defs/Modality" },
    "available_machines": {
      "type": "array",
      "description": "Machine ids available in the athlete's gym.",
      "items": { "type": "string" }
    },
    "current_supplements": {
      "type": "array",
      "description": "Supplement ids the athlete currently takes (their stack).",
      "items": { "type": "string" }
    },
    "weight_unit": { "$ref": "common.schema.json#/$defs/WeightUnit" },
    "supplement_macros": {
      "type": "array",
      "description": "User-entered nutrition facts for their current supplements.",
      "items": {
        "type": "object",
        "additionalProperties": false,
        "required": ["supplement_id", "macros"],
        "properties": {
          "supplement_id": { "type": "string" },
          "macros": { "$ref": "common.schema.json#/$defs/MacroNutrients" }
        }
      }
    },
    "photo_url": { "type": "string" },
    "weekly_training_goal": {
      "type": "integer",
      "description": "Target training days per week.",
      "minimum": 1,
      "maximum": 7
    },
    "rest_days_allowance": {
      "type": "integer",
      "description": "Wildcard rest days allowed per week before the streak breaks.",
      "minimum": 0,
      "maximum": 7
    },
    "loads": {
      "type": "array",
      "description": "Baseline loads the athlete normally lifts.",
      "items": { "$ref": "common.schema.json#/$defs/ExerciseLoad" }
    }
  }
}
