{
  "schema_version": "1.2.0",
  "profile_id": "8a2d4e6f-1b3c-4d5e-9f70-a1b2c3d4e5f6",
  "display_name": "Ana",
  "language": "ES",
  "is_guest": false,
  "height_cm": 165,
  "weight_kg": 62,
  "age": 29,
  "objective": "HYPERTROPHY",
  "modality": "MENSTRUAL_CYCLE",
  "loads": [
    { "exercise_id": "goblet-squat", "weight_kg": 18, "reps": 10 },
    { "exercise_id": "lat-pulldown", "weight_kg": 30, "reps": 12 }
  ]
}
